,Baile na Traghad,O| ’s alainn an t-aite,,,O| ’s alainn an t-aite,Homeland | Praise,"Judique | Nature",Eight line verse,Nova Scotia,Male ,Micheil,Domhnallach,Micheil Mor ,,Judique,Inverness,,Publication,,,,,,Vol. 3. No. 50,Mac-Talla,June 15 1895,8,http://www.smo.uhi.ac.uk/en/rannsachadh/leabharlann/cruinneachadh-didseatach-old/mac-talla-iris-3/,Bha Micheil Mor re geamhraidh leis fein ann an Siudig an Ceap Breatunn. ’S ann an sin a rinn e na rannan a thug mi seachad. Bha e ag iarraidh air a bhrathair a thiginn comhla-ris| ach cha digeadh e. ’S e bhrathair am baothair mu bheil e labhairt.,,,
,Suiridh Ruari,,,,Tha sgeula ri aithris,Humorous | Satire,,Twelve line verse,Scotland,Male ,Tormaid, Mac-Leoid,,1745 - 1824,Swordale,Skye,,Publication,,,,,,Vol. 3. No. 50,Mac-Talla,June 15 1895,8,http://www.smo.uhi.ac.uk/en/rannsachadh/leabharlann/cruinneachadh-didseatach-old/mac-talla-iris-3/,See Gaelic Bards from 1775 to 1825 A. MacLean Sinclair p. 11,,,
,Oisein Do'n Ghrein an Am Eiridh,,,,A ghrian na h-og-mhaidne| ’s tu ’g eiridh,Nature | Praise,Sun,Eight line verse,Scotland,Unknown,,,,,,,,Publication,,,,,,Vol. 3. No. 51,Mac-Talla,June 22 1895,8,http://www.smo.uhi.ac.uk/en/rannsachadh/leabharlann/cruinneachadh-didseatach-old/mac-talla-iris-3/,Tha na rannan so air an tabhairt bho “Shean Dana.” ’S e ’s dòcha gur h-e ’n t-Olla Mac-a-Ghobha e-fein a b’ughdar dhaibh.,,,
,M' Anam | Imich Thusa Samhach,,,,M’ anam imich thusa sàmhach,Religious,,Four line verse,Scotland,Female,Màiri ,Nic-a-Chleirich,,,Laggan,Badenoch,,Publication,,,,,,Vol. 3. No. 51,Mac-Talla,June 22 1985,8,http://www.smo.uhi.ac.uk/en/rannsachadh/leabharlann/cruinneachadh-didseatach-old/mac-talla-iris-3/,https://dasg.ac.uk/corpus/textmeta.php?text=140&uT=y,,,
,Cronan Altruim,,,Fa-ill ile na ho ru,Baidh| baidh bà| baidh bà mo ghradh,Lullaby,,Four line verse / Four line chorus,Scotland,Female,Mairead,Ghobha,,18th Century,,Atholl,,Publication,,,,,,Vol. 3. No. 52,Mac-Talla,June 29 1895,8,http://www.smo.uhi.ac.uk/en/rannsachadh/leabharlann/cruinneachadh-didseatach-old/mac-talla-iris-3/,https://www.jstor.org/stable/41219651?read-now=1&refreqid=excelsior%3A79cc731901f58d1a082e05dd8c6c412d&seq=4#page_scan_tab_contents,,,
,On Tha Mi fo Mhulad Air M' Aineol,Mo nighean donn a’s boidhche,,Hi ri ri ’s ho ra ill o,On tha mi fo mhulad air m’ aineol,Love | Homeland,,Four line verse / Four line chorus,Scotland,Male ,Rev. Charles,Stewart,Tearlach Stiubhart,,Strathchur,,,Publication,,,,,,Vol. 3. No. 52,Mac-Talla,June 29 1895,8,http://www.smo.uhi.ac.uk/en/rannsachadh/leabharlann/cruinneachadh-didseatach-old/mac-talla-iris-3/,See Sàr-obair nam Bàird p. 386,,,
,Taigh-Dige nan Fear Eachannach,,,,’S uaigneach an nochd ’tha geatachan,Elegy | Lament | Political,"Gairloch House | Eachannach",Eight line verse,Scotland,Male ,[ Alexander ],[ Campbell ],Alastair Buidhe Mac Iamhair,1767 - 1843,Gairloch,,,Publication,,,,,,Vol. 3. No. 52,Mac-Talla,June 29 1895,8,http://www.smo.uhi.ac.uk/en/rannsachadh/leabharlann/cruinneachadh-didseatach-old/mac-talla-iris-3/,Ground officer to MacKenzies of Gairloch . See The Celtic Magazine | Volume 4,https://www.electricscotland.com/history/gairloch/g243.htm [ interesting to note that he and William Ross were great friends ] ,,
,Taigh-Dige nan Fear Eachannach (Continued),,,,’S uaigneach an nochd ’tha geatachan,Elegy | Lament | Political,"Gairloch House | Eachannach",Eight line verse,Scotland,Male ,[ Alexander ],[ Campbell ],Alastair Buidhe Mac Iamhair,1767 - 1843,Gairloch,,,Publication,,,,,,Vol. 4. No. 1,Mac-Talla,June 29 1895,8,http://www.smo.uhi.ac.uk/en/rannsachadh/leabharlann/cruinneachadh-didseatach-old/mac-talla-iris-3/,Ground officer to MacKenzies of Gairloch . See The Celtic Magazine | Volume 4 ,https://www.electricscotland.com/history/gairloch/g243.html     , [ interesting to note that he and William Ross were great friends ] ,
,"Oran do bhirlinn Mhic-’Ic-Alasdair",,,Ho i uro bho ho eile,Slan gun till a bhirlinn Ghleannach,Praise | Political,MacDonald of Glengary's boat,Eight line verse,Scotland,Male ,[ Allan ],[ MacDougal ]l,Aliean Dall | Ailean Dughallach,c. 1750 - 1829,Glengarry,,1824,Publication,,,,,,Vol. 4. No. 1,Mac-Talla,July 6 1895,8,http://www.smo.uhi.ac.uk/en/rannsachadh/leabharlann/cruinneachadh-didseatach-old/mac-talla-iris-4/,Published in Orain| marbhrannan| agus duanagan| Ghaidhealach | 1829| p. 190,See biography of poet in Oxford Dictionary of National Biography http://www.oxforddnb.com/view/10.1093/ref:odnb/9780198614128.001.0001/odnb-9780198614128-e-17466,,
,Oran do bhirlinn Mhic-’Ic-Alasdair (Continued),,,Ho i uro bho ho eile,Slan gun till a bhirlinn Ghleannach,Praise | Political,MacDonald of Glengary's boat,Eight line verse,Scotland,Male ,[ Allan ],[ MacDougal ]l,Aliean Dall | Ailean Dughallach,c. 1750 - 1829,Glengarry,,1824,Publication,,,,,,Vol. 4. No. 2,Mac-Talla,July 19 1895,8,http://www.smo.uhi.ac.uk/en/rannsachadh/leabharlann/cruinneachadh-didseatach-old/mac-talla-iris-4/,Published in Orain| marbhrannan| agus duanagan| Ghaidhealach | 1829| p. 190,See biography of poet in Sar-Obair nam Bàrd p. 298,,
,Oran mu na Caoraich Mhora,,,,Deoch-Slaint’ ’Choirueil nach maireann,Complaint | Political, Coirneal Ghrannda | Great Sheep,Four line verse,Scotland,Male ,Iain,Grannda,Iain Mac Ghilleasbig,Post 1750,Tomb bheallaidh,,,Publication,,,,,,Vol. 4. No. 2,Mac-Talla,July 19 1895,8,http://www.smo.uhi.ac.uk/en/rannsachadh/leabharlann/cruinneachadh-didseatach-old/mac-talla-iris-4/,See biography of poet in Gaelic Bards 1775 to 1825 ed. A. MacLean Sinclair p. 33,,,
,Moladh na Luinge,,,Is beag mo shunnd ris an liunn,Ged a tha mi ann san am,Praise,Boat,Four line verse / Four line chorus,Scotland,Male ,Coinneach,"Mac-Coinnich",,Post 1758,Castle-Leathers,Inverness,,Publication,,,,,,Vol. 4. No. 2,Mac-Talla,July 19 1895,8,http://www.smo.uhi.ac.uk/en/rannsachadh/leabharlann/cruinneachadh-didseatach-old/mac-talla-iris-4/,See biography of poet in Gaelic Bards 1775 to 1825 ed. A. MacLean Sinclair p. 35,,,
,Call Ghadhaig,Cumha don Chaiptein Mac-Mhuirich| Fear Bhail-a-Chrothain,,,’S beag an t-ionghnadh mi ’bhi dubhach,Elegy | Lament | Political,,Eight line verse,Scotland,Male ,Calum,Mac-an-t-Saoir,Calum Dubh ,1755 - 1840,Dallanaich an Gleann-Truim,,,Publication,,,,,,Vol. 4. No. 3,Mac-Talla,July 20 1895,8,http://www.smo.uhi.ac.uk/en/rannsachadh/leabharlann/cruinneachadh-didseatach-old/mac-talla-iris-4/,http://www.bbc.co.uk/scotland/alba/radio/cuairtean/baideanach/cumha_call_gaick.shtml,See also Vol. 3. No. 14,,
,’S Fheudar Dhomh Bhi Beo,,,"’S fheudar dhomh bhi beo",S muladach a ta mi,Love,Sailing,Six line verse,Scotland,Unknown,,,,,,,,Publication,,,,,,Vol. 4. No. 3,Mac-Talla,July 20 1895,8,http://www.smo.uhi.ac.uk/en/rannsachadh/leabharlann/cruinneachadh-didseatach-old/mac-talla-iris-4/,For tune notation see 'An Gaidheal' vol. 2 p.107 https://digital.nls.uk/75905238,,,
,Call Ghadhaig (Continued),Cumha don Chaiptein Mac-Mhuirich| Fear Bhail-a-Chrothain,,,’S beag an t-ionghnadh mi ’bhi dubhach,Elegy | Lament | Political,,Eight line verse,Scotland,Male ,Calum,Mac-an-t-Saoir,Calum Dubh ,1755 - 1840,Dallanaich an Gleann-Truim,,,Publication,,,,,,Vol. 4. No. 4,Mac-Talla,August 3 1895,8,http://www.smo.uhi.ac.uk/en/rannsachadh/leabharlann/cruinneachadh-didseatach-old/mac-talla-iris-4/,http://www.bbc.co.uk/scotland/alba/radio/cuairtean/baideanach/cumha_call_gaick.shtml,See also Vol. 3. No. 14,,
,Oran Gaoil air Anna Buchanan,,,,Gur mise bheir gràdh gu bràth do ’n chailin,Love | Praise,"Anna Buchanan",Eight line verse,Nova Scotia | Scotland,Male ,Seumas,Mac-Groigair,"[ Rev. Jame MacGregor ]",1759 - 1830,Sgire Nuig a' Ros,Perthshire | Pictou,,Publication,,,,,,Vol. 4. No. 4,Mac-Talla,August 3 1895,8,http://www.smo.uhi.ac.uk/en/rannsachadh/leabharlann/cruinneachadh-didseatach-old/mac-talla-iris-4/,For biography of poet and notes on this song see Clarsach na Coille ed. A. MacLean Sinclair p.308 https://archive.org/details/clarsachnacoill00sincgoog/page/n308,,,
,An Duilleag,,,,Sgaraichte bho’n stoc| a’s reubta,Dialogue | Nature,Man | Leaf,Four line verse,Scotland,Unknown,M.,,,,Taobh Loch Nis,,1841,Publication,,,,,,Vol. 4. No. 5,Mac-Talla,"August 10 1895",8,http://www.smo.uhi.ac.uk/en/rannsachadh/leabharlann/cruinneachadh-didseatach-old/mac-talla-iris-4/,See also Cuairtear nan Gleann Vol. 1-3 Page 196 Signed by M. ,,,
,An Riomhinn [ Rìbhinn ] Ghlan Og ,Oran do dh-oigh uasail an Duneideann,,,Air dhomhsa ’bhi direadh,Love,,Ten line verse,Scotland,Male ,Iain,Mac-Griogair,Am Bard Smeatach,"c. 18th - 19th Century",,Perthshire,,Publication,,,,,,Vol. 4. No. 6,Mac-Talla,"August 17 1895",8,http://www.smo.uhi.ac.uk/en/rannsachadh/leabharlann/cruinneachadh-didseatach-old/mac-talla-iris-4/,See biography of poet in Gaelic Bards 1775 to 1825 ed. A. MacLean Sinclair p. 55,,,
,Bidh Fonn Oirre Daonnan,,,,Bidh fonn oirre daonnan,Love,,Eight line verse,Scotland,Male ,[ John ],[ Shaw ],Bàrd Loch nan Eala,Post 1758,Mull | Ardchattan,Argyleshire,,Publication,,,,,,Vol. 4. No. 7,Mac-Talla,"August 24 1895",8,http://www.smo.uhi.ac.uk/en/rannsachadh/leabharlann/cruinneachadh-didseatach-old/mac-talla-iris-4/,See biography of poet in Sar-obair nam Bàrd p. 311,,,
,Mairi Dhonn Thorr-a-Chaisteil,,,Mhair dhonn| bhoidheach| dhonn,Gu ma slàn do ’n mhaighdinn oig,Love,,Four line verse / Four line chorus,Scotland,Male ,Coinneach,Mac-Coinnich,,Post 1758,Castle-Leathers,Inverness,,Publication,,,,,,Vol. 4. No. 7,Mac-Talla,"August 24 1895",8,http://www.smo.uhi.ac.uk/en/rannsachadh/leabharlann/cruinneachadh-didseatach-old/mac-talla-iris-4/,See biography of poet in Gaelic Bards 1775 to 1825 ed. A. MacLean Sinclair p. 35,,,
,Mairi Laghach,,,Ho| mo Mhari laghach,Ged is trom a’ ghaillionn,Love | Praise,"Daughter Mairi",Four line verse / Four line chorus,Scotland,Male ,[ Murdo ],[ MacKenzie ],Murchadh Ruadh nam Bo,,Locharron,,,Publication,,,,,,Vol. 4. No. 8,Mac-Talla,August 31 1895,8,http://www.smo.uhi.ac.uk/en/rannsachadh/leabharlann/cruinneachadh-didseatach-old/mac-talla-iris-4/,See Celtic Monthly Volume 7 1899  page 7 for notes on song and poet https://digital.nls.uk/75858825, Bha Murchadh Ruadh na bhanntraich nuair a rinn e ’n t-oran. Bha triuir nighean aige| Mari| Seonaid| agus Peigi; ’s i Mari bu shine. ’S e ’s docha nach robh i| ach eadar ceithear-deug ’s a coig-deug ,,
,Mairi Chruinn Chuachach,,,,Bidh Mari ’measg nam maighdean,Praise | Political,"Daughter Mairi",Eight line verse,Scotland,Male ,[ Murdo ],[ MacKenzie ],Murchadh Ruadh nam Bo,,Locharron,,,Publication,,,,,,Vol. 4. No. 8,Mac-Talla,August 31 1895,8,http://www.smo.uhi.ac.uk/en/rannsachadh/leabharlann/cruinneachadh-didseatach-old/mac-talla-iris-4/,See Celtic Monthly Volume 7 1899  page 7 for notes on  poet https://digital.nls.uk/75858825, Thubhairt fear de choimhearsnich ri Murchadh Ruadh nach b’ urrinn e Mari a mholadh na b’ airde na rinn e. Rinn Murchadh an duanag a thug mi seachad a dhearbhadh gum b’ urrinn. ,,
,Air a’ Ghille tha mo Run,,,Air a’ ghille tha mo run,’S ann a fhuair thu t’ àrach òg,Love,,Four line verse / Four line chorus,Scotland,Unknown,,,,,,,,Publication,,,,,,Vol. 4. No. 9,Mac-Talla,"September 7 1895",8,http://www.smo.uhi.ac.uk/en/rannsachadh/leabharlann/cruinneachadh-didseatach-old/mac-talla-iris-4/,,,,
,Oran Gaoil,A Mhairi Bhoicheach,,A Mhairi bhoidheach| ’sa Mhairi ghaolach,A Mhari bhoidheach gur mor mo ghaol ort,Love,,Four line verse / Four line chorus,Scotland,Male ,Alasdair,Stiubhart,,,North Uist,,,Publication,,,,,,Vol. 4. No. 9,Mac-Talla,"September 7 1895",8,http://www.smo.uhi.ac.uk/en/rannsachadh/leabharlann/cruinneachadh-didseatach-old/mac-talla-iris-4/,Biography of poet http://www.bbc.co.uk/alba/oran/people/alasdair_stiubhart/,,,
,Cumha do Ghilleasbuig Mac-Gilleain Fear Chill-Mo-Lubhaig,,Gaoir nam ban Muileach,,Fhuair mi sgeula mo sgaraidh,Elegy | Political,,Seven line verse,Scotland,Male ,Gilleasbuig,MacGilleain,Gilleasbuig Laidir / Gilleasbuig Mac Lachainn Mhic ,Pre 1830,Kilmoluaig,Tiree,,Publication,,,,,,Vol. 4. No. 10,Mac-Talla,"September 14 1895",8,http://www.smo.uhi.ac.uk/en/rannsachadh/leabharlann/cruinneachadh-didseatach-old/mac-talla-iris-4/,See The MacLean Bards| ed A. MacLean Sinclair page 1 for biography of poet,,,
,Mo Mhathair,My Mother,,,Co thog mi air a broilleach tlàth,Praise | Political,Mother,Four line verse,Scotland,Female,Ann,Taylor,,1782 - 1866,Colchester,England,,Publication,,,,,,Vol. 4. No. 10,Mac-Talla,"September 14 1895",8,http://www.smo.uhi.ac.uk/en/rannsachadh/leabharlann/cruinneachadh-didseatach-old/mac-talla-iris-4/,Translated from English,,,
,Oran A rinneadh an deidh bas Dhomhnuill Mhic-Gilleain| Fear Chornaig an Cola.,,Cumha Fear Ile,,Gur h-e mis’ th’ air mo leonadh,Elegy | Lament,,Eight line verse,Scotland,Male ,Gilleasbuig,Mac-Gilleain,,Pre 1830,Kilmoluaig,Tiree,,Publication,,,,,,Vol. 4. No. 11,Mac-Talla,"September 21 1895",8,http://www.smo.uhi.ac.uk/en/rannsachadh/leabharlann/cruinneachadh-didseatach-old/mac-talla-iris-4/,See The MacLean Bards| ed A. MacLean Sinclair page 1 for biography of poet,,,
,Oran Gaoil,,,,’S bochd an creachal ’th’ air m’ inntinn,Love,,Three line verse,Scotland,Male ,Gilleasbig [ Gilleasbuig ],Mac-Phail,,Pre 1830,,Tiree,,Publication,,,,,,Vol. 4. No. 12,Mac-Talla,"September 28 1895",8,http://www.smo.uhi.ac.uk/en/rannsachadh/leabharlann/cruinneachadh-didseatach-old/mac-talla-iris-4/,See Clarsach na Coille p. 235 for biography of poet,,,
,Oran do Chailain Mac-Niomhain| Fear Ghrianail an Tirithe,,,,Thoir mo shoraidh gu Fear-Ghrianail,Elegy | Lament | Political,,Four line verse,Scotland,Male ,Gilleasbig [ Gilleasbuig ],Mac-Phail,,Pre 1830,,Tiree,,Publication,,,,,,Vol. 4. No. 12,Mac-Talla,"September 28 1895",8,http://www.smo.uhi.ac.uk/en/rannsachadh/leabharlann/cruinneachadh-didseatach-old/mac-talla-iris-4/,See Clarsach na Coille p. 235 for biography of poet,,,
,Moladh Do 'n Fheiceadan Dubh,,,,Faigheadh cliu o gach rann-fhear,Praise | Political,"Blackwatch | Soldiers",Eight line verse,Scotland,Male ,Rob,Mac-Griogair,,,,,,Publication,,,,,,Vol. 4. No. 12,Mac-Talla,"September 28 1895",8,http://www.smo.uhi.ac.uk/en/rannsachadh/leabharlann/cruinneachadh-didseatach-old/mac-talla-iris-4/,,,,
,Blar na h-Olaint,,,,Air mios deireannach an fhoghair,Praise | Historical | Political,War| Battle of Alexandria,Eight line verse,Scotland,Male ,Alasdair,Mac-Fhionghain,,1770 - 1814,Arisaig,Morar,,Publication,,,,,,Vol. 4. No. 13,Mac-Talla,"October 5 1895",8,http://www.smo.uhi.ac.uk/en/rannsachadh/leabharlann/cruinneachadh-didseatach-old/mac-talla-iris-4/,See Sar-obair nam Bàrd p. 340 for biography of poet,,,
,Oran an t-Saighdeir,,,,Is cianail an rathad,Complaint,Soldier,Eight line verse,Scotland,Male ,[ Alexander ],[ Grant ],"Alasdair Mac Iain Bhain","c. 1772 - c. 1804",Achnaconeran,,,Publication,,,,,,Vol. 4. No. 14,Mac-Talla,"October 12 1895",8,http://www.smo.uhi.ac.uk/en/rannsachadh/leabharlann/cruinneachadh-didseatach-old/mac-talla-iris-4/,,,,
,Oran,,,,Mo bheannachd ort a Thormaid,Praise | Political,Tormad,Eight line verse,Scotland,Male ,,,Calum mac Iain 'ic Phadruig,,Harris | Framboise,,,Publication,,,,,,Vol. 4. No. 14,Mac-Talla,"October 12 1895",8,http://www.smo.uhi.ac.uk/en/rannsachadh/leabharlann/cruinneachadh-didseatach-old/mac-talla-iris-4/,A rinneadh le Calum Mac Iain ’ic Phàdruig| anns na Hearreadh agus a chuir e dh’ ionnsuidh caraide dha a tha fuireach a nis ann a Framboise| an Ceap Breatuinn. ’S ann air an fhoghar so fhéin a rinnedh an t-òran.,,,
,"Oran (continued)",,,,Mo bheannachd ort a Thormaid,Praise | Political,,Eight line verse,Scotland,Male ,,,Calum mac Iain 'ic Phadruig,,Harris | Framboise,,,Publication,,,,,,Vol. 4. No. 15,Mac-Talla,"October 19 1895",8,http://www.smo.uhi.ac.uk/en/rannsachadh/leabharlann/cruinneachadh-didseatach-old/mac-talla-iris-4/,A rinneadh le Calum Mac Iain ’ic Phàdruig| anns na Hearreadh agus a chuir e dh’ ionnsuidh caraide dha a tha fuireach a nis ann a Framboise| an Ceap Breatuinn. ’S ann air an fhoghar so fhéin a rinnedh an t-òran.,,,
,Ealaidh Ghaoil,,,Air failirinn| illirin| uillirin o,Gur gile mo leannan,Love,,Eight  line verse / Four line chorus,Scotland,Male ,Eoghain,"Mac-Lachainn",,,,,,Publication,,,,,,Vol. 4. No. 15,Mac-Talla,October 19 1895,8,http://www.smo.uhi.ac.uk/en/rannsachadh/leabharlann/cruinneachadh-didseatach-old/mac-talla-iris-4/,,,,
,Reis na Dunich,,,,Tha fleasgach ’sna bailtean,Humorous,"Horse | Accident",Twelve  line verse,Scotland,Male ,Domhnull,Domhnallach,Domhnull Domhnullach An Tirithe,,,Tiree,,Publication,,,,,,Vol. 4. No. 16,Mac-Talla,"October 26 1895",8,http://www.smo.uhi.ac.uk/en/rannsachadh/leabharlann/cruinneachadh-didseatach-old/mac-talla-iris-4/,,,,
,Cha Till Mac-Cruimean,,,,Dh’ iadh ceò nan stùc mu aodann Chuilinn,Port à Beul,,Four line verse,Scotland,Unknown,,,,,,,,Publication,,,,,,Vol. 4. No. 17,Mac-Talla,"November 2 1895",2,http://www.smo.uhi.ac.uk/en/rannsachadh/leabharlann/cruinneachadh-didseatach-old/mac-talla-iris-4/,Included in article : Calann 'ic-Cruimean submitted by Tormoid Mac Leoid,,,
,Cumha Ruairidh Mhoir,,,,Tog arm mo phiob ’us théid mi dhachaidh,Port à Beul,,Four line verse,Scotland,Unknown,,,,,,,,Publication,,,,,,Vol. 4. No. 17,Mac-Talla,"November 2 1895",2,http://www.smo.uhi.ac.uk/en/rannsachadh/leabharlann/cruinneachadh-didseatach-old/mac-talla-iris-4/,Included in article : Calann 'ic-Cruimean submitted by Tormoid Mac Leoid,,,
,Oran,,,,S ann fhuair mi sgeula na dunaich,Humorous | Political,"Hunting deer | Cold",Eight line verse,Ontario,Male ,Domhnull,Moireastan,Domhnull Fidhleir,,,Glengarry,,Publication,,,,,,Vol. 4. No. 17,Mac-Talla,"November 2 1895",8,http://www.smo.uhi.ac.uk/en/rannsachadh/leabharlann/cruinneachadh-didseatach-old/mac-talla-iris-4/,A rinneadh le Domhnull Moireastan (Domhnull Fidhleir) ann a Siorramachd Ghleann a Garradh| an Ontario| an Canada| mu ’n bhliadhna 1825| do dhithis choimhearsnach| Tormod Mac Leoid| us Calum Mac Criomain| duine làidir foghainteach a mharbh damh la anabarrach fuar s’a gheamhradh. Bha an latha cho fuar ’s ’gum b’ eigin dhaibh an damh a thoirt a stigh don tigh ga mharbhadh| a thaobh snach robh aite fasgach ceart am muigh aca. Cha robh ann ach tigh beag ùr de dh’ fiodh.,Submitted by Aonghas Mac Ille-Mhaoil,,
,Oran Gaoil,,,A Mhari mhiogach| mheallshuileach,Gur fada leam an ràidhe so,Love,Emigration | Mairi Nic-Gilleain,Four line verse / Four line chorus,Scotland,Male ,Ailain,Mac-a-Leith,,,,,,Publication,,,,,,Vol. 4. No. 18,Mac-Talla,November 9 1895,8,http://www.smo.uhi.ac.uk/en/rannsachadh/leabharlann/cruinneachadh-didseatach-old/mac-talla-iris-4/,See Clarsach na Coille p. 296,,,
,Clachan Ghlinn-Daruail,,,Mo chaileag bhian-gheal| mheall-shuileach,Di-donhmich rinn mi chomhlachadh [ DiDomhnaich ],Love,Lost Love,Four line verse / Four line chorus,Scotland,Male ,Aonghas,Mac-an-Fheisdeir,,,Uig,Skye,,Publication,,,,,,Vol. 4. No. 18,Mac-Talla,November 9 1895,8,http://www.smo.uhi.ac.uk/en/rannsachadh/leabharlann/cruinneachadh-didseatach-old/mac-talla-iris-4/,,,,
,An Aiseiridh,,,,Och| a luchd-aiteachidh na h-uaigh’,Religious,"Death | Resurrection",Four line verse,Scotland,Male ,,,Domhnallach an Toiseachd,,,,,Publication,,,,,,Vol. 4. No. 19,Mac-Talla,November 16 1895,8,http://www.smo.uhi.ac.uk/en/rannsachadh/leabharlann/cruinneachadh-didseatach-old/mac-talla-iris-4/,,,,
,Oran Leinibh,Oran Òran mu Leanabh Òg,,,’S leanabh sòlasach mi,Religious,"Child | Baby going to Heaven",Six line verse,Scotland,Male ,"[ An t-Urr ] Padruig",Grannda,Pàdraig Grannd nan Òran,,,,,Publication,,,,,,Vol. 4. No. 19,Mac-Talla,November 16 1895,8,http://www.smo.uhi.ac.uk/en/rannsachadh/leabharlann/cruinneachadh-didseatach-old/mac-talla-iris-4/,https://en.wikipedia.org/wiki/Peter_Grant_(pastor),,,
,Oran Do Dhotair Ailain Mac-Gilleain as an Ros Mhuileach,,,O soraidh slan do ’n ailleagan,Tha ionndrainn bhuaiun ’s an àite so,Praise,Dr. Allen MacLean,Four line verse / Four line chorus,Scotland,Male ,[ Donald ],[ MacLean ],Domhnall Bac Mac-Gilleain / Domhnall Ban an Lioba,Post 1780,Ross,Mull,,Publication,,,,,,Vol. 4. No. 20,Mac-Talla,November 23 1895,8,http://www.smo.uhi.ac.uk/en/rannsachadh/leabharlann/cruinneachadh-didseatach-old/mac-talla-iris-4/, Do Dhotair Ailain Mac-Gilleain as an Ros Mhuileach| an uair a bha e dol air chuairt do’n eilein Sgitheanach agus a chaidh cunnart bathaidh air. Bha ’n Dotair Ruadh pòsda ri Fionnaghal| nighean Mhurchaidh Lochabuidhe. Chaochail e mu’n bhliadhna 1828.,See The Gaelic  Bards 1775 to 1825| by A. MacLean Sinclair p. 137,,
,Oran Gaoil,,,"Ho mo Mhairi laghach","B’ og ’bha mis’ is Mairi  ’M fasaichean Ghlinn-Smeoil",Love,,Four line verse / Four line chorus,Scotland,Male ,Iain,Domhnallach,,,,,,Publication,,,,,,Vol. 4. No. 21,Mac-Talla,"November 30 1895",8,http://www.smo.uhi.ac.uk/en/rannsachadh/leabharlann/cruinneachadh-didseatach-old/mac-talla-iris-4/,See Sar-obair nam Bard| 1907 p. 405 for notes on song and poet / https://archive.org/details/sarobairnambardg04mack/page/405?q=Sar-obair,,,
,Oran d'a Leannan,,,,O| ciamar ’s urrainn mi bhi beo,Love,,Eight line verse,Scotland,Male ,Domhnull,Domhnullach,Am Bard Conanach,Post 1780,Strathconnan,Ross-shire,,Publication,,,,,,Vol. 4. No. 21,Mac-Talla,"November 30 1895",8,http://www.smo.uhi.ac.uk/en/rannsachadh/leabharlann/cruinneachadh-didseatach-old/mac-talla-iris-4/,See Sar-obair nam Bard p. 381 for notes on song and poet,https://archive.org/details/sarobairnambardg04mack/page/376?q=Sar-obair,,
,Smeorach nan Leodach,,,Uilibh i na i ri u o,’S mise smeorach òg a ghrinnis,Nature | Praise,,Four line verse / Four line chorus,Scotland,Male ,[ Donald ],[ MacLeod ],Domhnull nan Oban ,,,,,Publication,,,,,,Vol. 4. No. 21,Mac-Talla,"November 30 1895",8,http://www.smo.uhi.ac.uk/en/rannsachadh/leabharlann/cruinneachadh-didseatach-old/mac-talla-iris-4/,Am Bard Sgiathach [ in Sar-Obair nam Bàrd ],,,
,Oran air cuairt do dh' America,,,,Ann an toiseach an fhoghair,Exile | Complaint,Emigration | Deline of Gaelic leadership,Eight line verse,Scotland,Male ,[ Alexander ],[ MacLean ],An Cubair Colach,Pre 1838,,Coll,,Publication,,,,,,Vol. 4. No. 22,Mac-Talla,"December 7 1895",8,http://www.smo.uhi.ac.uk/en/rannsachadh/leabharlann/cruinneachadh-didseatach-old/mac-talla-iris-4/,See MacLean Bards https://archive.org/details/nabairdleathanac1900sinc/page/8,,,
,Earbsa,"My Father's at the Helm",,,Dh’ eirich an fhairge| ’s shéid a’ ghaoth,Religious,,Four line verse,Scotland,Unknown,,,,,,,,Publication,,,,,,Vol. 4. No. 23,Mac-Talla,"December 14 1895",8,http://www.smo.uhi.ac.uk/en/rannsachadh/leabharlann/cruinneachadh-didseatach-old/mac-talla-iris-4/,Translated from English,,,
,Pharaoh,,,,Faic uachdran na h-Eiphit,Historical | Religious,Pharaoh | Israel,Eight line verse,Scotland,Unknown,,,,,,,,,,,,,,,,,,,,,,
,Clann nan Gaidheal,,,Tha tigh’nn fodham| fodham| fodham,Siol nan sonn ’s nan curaidhean,Praise | Political,Gaelic,Four line verse / Four line chorus,Scotland,Male ,Niall,MacLeoid,,,,,,Publication,,,,,,Vol. 4. No. 24,Mac-Talla,"December 21 1895",8,http://www.smo.uhi.ac.uk/en/rannsachadh/leabharlann/cruinneachadh-didseatach-old/mac-talla-iris-4/,Reprinted from Celtic Monthly| Vol. 4,,,
,Theid mi null thar an Atlantic,,,Theid mi null thar an Atlantic,Tha mo cridhe-s’ an Ur-Albainn,Political | Exile,"Nova Scotia | County Fermoy| Hattie Og",Four line verse / Four line chorus,Scotland,Male ,R. Frazer,MacKenzie,,,,,,Publication,,,,,,Vol. 4. No. 24,Mac-Talla,"December 21 1895",8,http://www.smo.uhi.ac.uk/en/rannsachadh/leabharlann/cruinneachadh-didseatach-old/mac-talla-iris-4/,Reprinted from Celtic Monthly| Vol. 4,,,
,Marbhrann do Eachann Mac Aoidh,,,,Tha sinne a nis cràiteach,Lament | Elegy | Political,"Hector MacKay",Four line verse,Nova Scotia | Ontario,Unknown,,,,,Lake Ainsley | Strathlorne | Teeswater,Inverness | Culross | Bruce,,Publication,,,,,,Vol. 4. No. 25,Mac-Talla,"December 28 1895",8,http://www.smo.uhi.ac.uk/en/rannsachadh/leabharlann/cruinneachadh-didseatach-old/mac-talla-iris-4/,Rugadh Eachann Mac Aoidh ann an Eilean-nam-Muc| ann an Albainn ’s a bhliadhna 1809. Thainig athair agus an teaghlach uile gu America ’s a bhliadhna 1821| agus shuidhich iad aig ceann tuath Loch Ainslie ann an Eilean Cheap Breatuinn| …,,,
,A' Bhliadhn' Ur,O mo chaochladh mor a thainig,,O mo chaochladh mor a thainig,O’n a thainig a bhliadhn’ ùr oirnn,Lament | Complaint | Local events and characters,Decline of Gaelic | community,Four line verse / Four line chorus,Unknown,Unknown,,,,,,,,Publication,,,,,,Vol. 4. No. 26,Mac-Talla,"January 4 1896",8,http://www.smo.uhi.ac.uk/en/rannsachadh/leabharlann/cruinneachadh-didseatach-old/mac-talla-iris-4/,Chuireadh an t-òran bòidheach so ugainn le caraid nach eil air son ainm a chur ris. Is òran e a tha gle fhreagarrach mu’n so ’n bhliadhna| agus ged tha ’n t-ùghdar ag radh “nach buin dha cliù na bàrdachd|” ’s iomadh bàrd aig nach rachadh air briathran cho bòidheach ’s cho firinneach a chur an eagaibh a chéile.,,,
,Soraidh Slan le Fionn-Airidh,,,Eirich agus tiugainn O,Tha ’n latha math| ’s an soirbheas ciùin,Homeland | Praise,Fionnairigh,Four line verse / Four line chorus,Scotland,Male ,[ Rev. Norman ],[ MacLeod ],Caraid nan Gaidheal,1745 - 1824,,,,Publication,,,,,,Vol. 4. No. 27,Mac-Talla,January 11 1896,8,http://www.smo.uhi.ac.uk/en/rannsachadh/leabharlann/cruinneachadh-didseatach-old/mac-talla-iris-4/,http://www.bbc.co.uk/alba/oran/people/an_urr_tormod_macleoid_caraid_nan_gaidheal/,,,
